id,code,name,active
company_activity_513906,513906,"VENTA AL POR MAYOR DE ARTICULOS, ARTEFACTOS, DISCOS Y MUEBLES PARA EL HOGAR",TRUE
company_activity_513907,513907,VENTA AL POR MAYOR DE DISCOS COMPACTOS Y OTROS DISPOSITIVOSDE GRABACION,TRUE
company_activity_513910,513910,VENTA AL POR MAYOR DE TODO TIPO DE ARTICULOS POR CATALOGO,TRUE
company_activity_514101,514101,VENTA AL POR MAYOR DE COMBUSTIBLES SOLIDOS (LENA Y SIMILARES),TRUE
company_activity_514103,514103,VENTA AL POR MAYOR DE COMBUSTIBLES SOLIDOS (CARBON),TRUE
company_activity_514201,514201,VENTA AL POR MAYOR DE METALES Y MINERALES METALIFEROS,TRUE
company_activity_514304,514304,VENTA AL POR MAYOR DE EQUIPO DE AIRE ACONDICIONADO Y CALENTADORES (ELECTRICOS),TRUE
company_activity_514308,514308,"VENTA AL POR MAYOR DE  MATERIALES PARA LA CONTRUCCION, ARTICULOS DE FERRETERIA,",TRUE
company_activity_514701,514701,"VENTA AL POR MAYOR DE PRODUCTOS,SUSTANCIAS O REACTIVOS QUIMICOS Y SOLVENTES",TRUE
company_activity_514901,514901,VENTA AL POR MAYOR  Y AL POR MENOR DE CHATARRA,TRUE
company_activity_514903,514903,VENTA AL POR MAYOR DE PRODUCTOS PARA USO AGROPECUARIO Y VENTA DESECHOS ORGANICOS,TRUE
company_activity_515001,515001,"VENTA AL POR MAYOR DE MAQUINARIA Y EQUIPO INDUSTRIAL, DE CONSTRUCCION, INGENIERIA",TRUE
company_activity_515002,515002,VENTA AL POR MAYOR DE REPUESTOS Y/O ACCESORIOS PARA MAQUINARIA Y EQUIPO AGROPECUARIO,TRUE
company_activity_515003,515003,VENTA AL POR MAYOR DE MAQUINARIA Y EQUIPO AGROPECUARIO,TRUE
company_activity_515004,515004,VENTA AL POR MAYOR DE EXTINTORES Y EQUIPO SIMILAR,TRUE
company_activity_515201,515201,"VENTA AL  POR MAYOR DE EQUIPO DE COMPUTO, SUS PARTES Y ACCESORIOS",TRUE
company_activity_515203,515203,VENTA AL POR MAYOR DE EQUIPO Y SUMINISTROS DE OFICINA,TRUE
company_activity_519003,519003,"VENTA AL POR MAYOR DE EQUIPO, ARTICULOS Y ACCESORIOS DE BELLEZA, COSMETICOS E HIGIENE",TRUE
company_activity_519005,519005,VENTA AL POR MAYOR DE EQUIPO PARA CAMPO DE JUEGOS (PLAY),TRUE
company_activity_519006,519006,DISTRIBUCION Y COMERCIALIZACION AL POR MAYOR DE MATERIAL DEEMPAQUE,TRUE
company_activity_519010,519010,COMERCIALIZACION Y DISTRIBUCION AL POR MAYOR DE ALIMENTOS PREPARADOS PARA ANIMAL,TRUE
company_activity_519011,519011,COMERCIO AL POR MAYOR DE EQUIPO Y ACCESORIOS PARA PESCA DEPORTIVA O ARTESANAL,TRUE
company_activity_519013,519013,COMERCIALIZACION AL POR MAYOR DE SUPLEMENTOS ALIMENTICIOS,TRUE
company_activity_519014,519014,VENTA AL POR MAYOR DE POLEN Y/O  SEMILLAS PARA USO AGRICOLA,TRUE
company_activity_519015,519015,VENTA AL POR MAYOR DE OTROS PRODUCTOS NO ESPECIALIZADOS,TRUE
company_activity_519016,519016,VENTA AL POR MAYOR DE ARTICULOS Y ACCESORIOS ELECTRONICOS,TRUE
company_activity_521101,521101,"VENTA AL POR MENOR EN SUPERMERCADOS, ALMACENES Y SIMILARES DE PRODUCTOS ALIMENTICIOS",TRUE
company_activity_521102,521102,"VENTA AL POR MENOR DE ESPECIAS, SALSAS Y CONDIMENTOS",TRUE
company_activity_521201,521201,VENTA AL POR MENOR EN TIENDAS POR DEPARTAMENTOS,TRUE
company_activity_521202,521202,PULPERIAS ( MINI-SUPER)(SIN CANTINA),TRUE
company_activity_521901,521901,VENTA AL POR MENOR EN TIENDAS POR DEPARTAMENTOS,TRUE
company_activity_522001,522001,COMERCIO AL POR MENOR DE CONFITES Y OTROS PRODUCTOS RELACIONADOS (CONFITERIA),TRUE
company_activity_522002,522002,"VENTA AL POR MENOR DE CARNE DE BOVINO, PORCINO Y AVES (ADEMAS EMBUTIDOS), INCLUIDOS EN CANASTA BASICA",TRUE
company_activity_522003,522003,MACROBIOTICAS,TRUE
company_activity_522004,522004,VENTA AL POR MENOR DE PRUTAS Y VERDURAS FRESCAS INCLUIDAS EN CANASTA BASICA,TRUE
company_activity_522005,522005,VENTA AL POR MENOR DE PESCADOS INCLUIDOS EN CANASTA BASICA,TRUE
company_activity_522007,522007,LICORERIAS Y/O DEPOSITO DE LICORES (VENTA AL POR MENOR),TRUE
company_activity_522008,522008,VENTA AL POR MENOR DE HUEVOS DE GALLINA INCLUIDOS EN LA CANASTA BASICA,TRUE
company_activity_522009,522009,"VENTA AL POR MENOR DE PRUTAS Y VERDURAS FRESCAS, NO INCLUIDAS EN CANASTA BASICA",TRUE
company_activity_522011,522011,"PREPARACION, SERVICIO Y VENTA DE FRUTAS PICADAS Y BEBIDAS DE FRUTAS Y/O LEGUMBRE",TRUE
company_activity_522012,522012,COMERCIO AL POR MENOR DE BEBIDAS GASEOSAS Y CARBONATADAS,TRUE
company_activity_522013,522013,COMERCIO AL POR MENOR DE AGUA EMBOTELLADA,TRUE
company_activity_522016,522016,COMERCIO AL POR MENOR DE PRODUCTOS DE TABACO,TRUE
company_activity_522017,522017,"VENTA AL POR MENOR DE CARNE DE BOVINO, PORCINO Y AVES (ADEMAS EMBUTIDOS) NO INCLUIDOS EN CANASTA BASICA",TRUE
company_activity_522018,522018,"VENTA AL POR MENOR  DE PESCADOS Y MARISCOS , ASI COMO OTROS PRODUCTOS DE ORIGEN MARINO",TRUE
company_activity_522020,522020,VENTA AL POR MENOR DE OTROS ALIMENTOS INCLUIDOS EN CANASTA BASICA,TRUE
company_activity_522021,522021,VENTA AL POR MENOR DE OTROS ALIMENTOS NO INCLUIDOS EN CANASTA BASICA,TRUE
company_activity_523101,523101,FARMACIAS,TRUE
company_activity_523102,523102,VENTA AL POR MENOR DE COSMETICOS Y PERFUMERIA,TRUE
company_activity_523103,523103,VENTA AL POR MENOR DE PROTESIS EN GENERAL,TRUE
company_activity_523201,523201,BAZARES,TRUE
company_activity_523202,523202,VENTA AL POR MENOR DE ROPA (BOUTIQUE),TRUE
company_activity_523203,523203,VENTA AL POR MENOR DE CALZADO (ZAPATAERIAS),TRUE
company_activity_523204,523204,PASAMANERIAS,TRUE
company_activity_523205,523205,"VENTA AL POR MENOR DE PRENDAS DE VESTIR, ROPA Y ZAPATOS (TIENDAS)",TRUE
company_activity_523206,523206,SERVICIO DE FOTOCOPIADORA,TRUE
company_activity_523207,523207,VENTA AL POR MENOR DE ARTICULOS DE CUERO (EXCEPTO CALZADO),TRUE
company_activity_523208,523208,VENTA AL POR MENOR DE PRODUCTOS TEXTILES (TELAS),TRUE
company_activity_523209,523209,VENTA AL POR MENOR DE MATERIALES PARA CALZADO,TRUE
company_activity_523301,523301,COMERCIO AL POR MENOR DE OBJETOS DE CERAMICA  Y PORCELANA,TRUE
company_activity_523302,523302,VENTA AL POR MENOR DE CRISTALERIA,TRUE
company_activity_523303,523303,"VENTA AL POR MENOR DE DISCOS, CD'S Y OTROS SIMILARES",TRUE
company_activity_523304,523304,"VENTA AL POR MENOR DE ELECTRODOMESTICOS, MUEBLES Y ARTICULOS PARA EL HOGAR",TRUE
company_activity_523306,523306,VENTA AL POR MENOR DE ANTIGUEDADES,TRUE
company_activity_523308,523308,"VENTA AL POR MENOR DE INSTRUMENTOS MUSICALES, PARTES Y ACCESORIOS",TRUE
company_activity_523309,523309,VENTA DE CUADROS PINTURAS HECHAS POR PINTORES NACIONALES Y EXTRANJEROS PRODUCIDO,TRUE
company_activity_523401,523401,VENTA AL POR MENOR DE DEPOSITO DE MADERA,TRUE
company_activity_523402,523402,VENTA AL POR MENOR ARTICULOS DE FERRETERIA PINTURAS MADERA Y MATERIALES PARA LA CONSTRUCCION,TRUE
company_activity_523403,523403,VENTA DE PINTURAS,TRUE
company_activity_523404,523404,VENTA AL POR MENOR DE VIDRIO PARA LA CONSTRUCCION,TRUE
company_activity_523405,523405,VENTA AL POR MENOR DE MATERIALES PARA LA CONSTRUCCION,TRUE
company_activity_523406,523406,"VENTA AL POR MENOR DE ARTICULOS ELECTRONICOS, ELECTRICOS Y SIMILARES",TRUE
company_activity_523407,523407,VENTA AL POR MENOR DE PLYWOOD,TRUE
company_activity_523501,523501,VENTA AL POR MENOR REALIZADA DENTRO DEL DEPOSITO LIBRE COMERCIAL DE GOLFITO.,TRUE
company_activity_523601,523601,"COMERCIO AL POR MENOR DE COMPUTADORAS, ACCESORIOS, MICROCOMPONENTES Y PAQUETES ",TRUE
company_activity_523701,523701,LIBRERIAS,TRUE
company_activity_523702,523702,VENTA AL POR MENOR DE REVISTAS/PERIODICOS EN PUESTOS DE VENTAS O MERCADOS,TRUE
company_activity_523703,523703,VENTA AL POR MENOR DE LIBROS (EXCEPTO EN MEDIOS ELECTRONICOS),TRUE
company_activity_523801,523801,VENTA AL POR MENOR DE ARMAS (ARMERIAS),TRUE
company_activity_523803,523803,VENTA AL POR MENOR DE MAQUINARIA Y EQUIPO DE TODO TIPO Y ARTICULOS CONEXOS,TRUE
company_activity_523805,523805,"VENTA AL POR MENOR DE PURIFICADORES DE AGUA, SUS PARTES Y REPUESTOS",TRUE
company_activity_523806,523806,VENTA AL POR MENOR DE MAQUINARIA INDUSTRIAL USADA,TRUE
company_activity_523807,523807,"VENTA AL POR MENOR DE REPUESTOS NUEVOS PARA MAQUINARIA, EQUIPO Y OTROS",TRUE
company_activity_523808,523808,"VENTA AL POR MENOR DE REPUESTOS USADOS PARA MAQUINARIA, EQUIPO Y OTROS",TRUE
company_activity_523901,523901,VENTA AL POR MENOR DE OTROS PRODUCTOS EN ALMACENES ESPECIALIZADOS,TRUE
company_activity_523902,523902,VENTA AL POR MENOR DE SUMINISTROS Y/0 EQUIPO DE OFICINA,TRUE
company_activity_523903,523903,VENTA AL POR MENOR DE FLORES,TRUE
company_activity_523904,523904,SERVICIOS DE REPARACION DE JOYERIA Y RELOJERIA EN GENERAL,TRUE
company_activity_523905,523905,"VENTA AL POR MENOR DE JOYERIA, RELOJERIA Y BISUTERIA",TRUE
company_activity_523906,523906,VENTA AL POR MENOR CELULARES ACCESORIOS EQUIPO Y ART PARA COMUNICACIONES ,TRUE
company_activity_523907,523907,FLORISTERIA,TRUE
company_activity_523908,523908,COMERCIO AL POR MENOR DE ANIMALES DOMESTICOS PARA CONSUMO HUMANO,TRUE
company_activity_523909,523909,VENTA DE PRODUCTOS DE ARTESANIA Y SOUVENIR,TRUE
company_activity_523910,523910,VENTA AL POR MENOR DE JUGUETES Y/O ARTICULOS DE ESPARCIMIENTO,TRUE
company_activity_523911,523911,VENTA AL POR MENOR DE OTROS PRODUCTOS NUEVOS EN COMERCIOS ESPECIALIZADOS NO INCLUIDOS EN CANASTA BASICA,TRUE
company_activity_523912,523912,VENTA AL POR MENOR Y MAYOR DE PRODUCTOS E INSUMOS AGROPECUARIOS,TRUE
company_activity_523913,523913,VENTA AL POR MENOR DE ANIMALES DOMESTICOS PARA MASCOTAS.,TRUE
company_activity_523915,523915,DISTRIBUCION Y VENTA DE GAS EN CILINDRO,TRUE
company_activity_523916,523916,COMERCIO AL POR MENOR DE ALIMENTOS Y PRODUCTOS N.C.P. EXENTOS DE IVA,TRUE
company_activity_523917,523917,VENTA AL POR MENOR DE BICICLETAS Y SUS ACCESORIOS,TRUE
company_activity_523918,523918,VENTA AL POR MENOR DE EQUIPO DE AUDIO Y VIDEO,TRUE
company_activity_523919,523919,VENTA AL POR MENOR DE ARTICULOS Y ACCESORIOS ORTOPEDICOS,TRUE
company_activity_523920,523920,VENTA AL POR MENOR DE ANTEOJOS Y ARTICULOS OPTICOS (OPTICA),TRUE
company_activity_523921,523921,"VENTA AL POR MENOR DE CAJAS REGISTRADORAS, CALCULADORAS O MAQUINAS DE CONTABILIDAD",TRUE
company_activity_523922,523922,VENTA AL POR MENOR DE POLEN Y SEMILLAS,TRUE
company_activity_523923,523923,VENTA AL POR MENOR DE REPUESTOS PARA ELECTRODOMESTICOS,TRUE
company_activity_523925,523925,VENTA AL POR MENOR DE EXTINTORES,TRUE
company_activity_523926,523926,MANTENIMIENTO DE EXTINTORES,TRUE
company_activity_523927,523927,REPARACION EQUIPO DE AUDIO Y VIDEO,TRUE
company_activity_523929,523929,VENTA DE PERROS ENTRENADOS PARA SEGURIDAD,TRUE
company_activity_523930,523930,VENTA AL POR MENOR DE PIEZAS DE BAMBU,TRUE
company_activity_523935,523935,VENTA AL POR MENOR DE OTROS PRODUCTOS NUEVOS EN COMERCIOS ESPECIALIZADOS NO INCLUIDOS EN CANASTA BASICA,TRUE
company_activity_524001,524001,VENTA DE TODO TIPO DE ARTICULOS USADOS,TRUE
company_activity_524002,524002,CASA DE EMPENO Y AFIN,TRUE
company_activity_524004,524004,VENTA DE LIBROS USADOS,TRUE
company_activity_524005,524005,"VENTA DE MONEDAS, BILLETES,ESTAMPILLAS (NUEVAS Y USADAS) PARA COLECCION ",TRUE
company_activity_525101,525101,VENTA AL POR MENOR DE TODO TIPO DE ARTICULOS POR CATALOGO,TRUE
company_activity_525201,525201,VENTA DE REVISTAS/PERIODICOS (PUESTOS CALLEJEROS),TRUE
company_activity_525301,525301,VENTA AL POR MENOR DE LOTERIA Y SIMILARES,TRUE
company_activity_525303,525303,EMISION DE LA LOTERIA NACIONAL Y SIMILARES,TRUE
company_activity_525901,525901,VENTA DE ALFOMBRAS Y TAPICES,TRUE
company_activity_525902,525902,VENTA AMBULANTE DE ARTICULOS PARA EL HOGAR,TRUE
company_activity_525903,525903,VENTA DE LIBROS A DOMICILIO,TRUE
company_activity_525904,525904,TRABAJOS DE  MANUALIDADES,TRUE
company_activity_525905,525905,"VENTA AL POR MENOR DE TARJETAS TELEFONICAS, PINES, TIEMPO AIRE Y SIMILARES",TRUE
company_activity_526001,526001,SERVICIOS DE REPARACION DE ZAPATOS,TRUE
company_activity_526002,526002,REPARACION DE MUEBLES Y ACCESORIOS DOMESTICOS,TRUE
company_activity_526003,526003,REPARACION DE BICICLETAS,TRUE
company_activity_526005,526005,"ELECTRICISTA, SERVICIOS",TRUE
company_activity_526006,526006,REPARACION DE ARTICULOS ELECTRICOS,TRUE
company_activity_526008,526008,REPARACION Y MANTENIMIENTO DE PERSIANAS Y CORTINAS,TRUE
company_activity_526010,526010,INSTALACION Y MANTENIMIENTO DE PERSIANAS Y CORTINAS,TRUE
company_activity_526011,526011,REPARACION Y MANTENIMIENTO DE EQUIPO PARA TELECOMUNICACIONES,TRUE
company_activity_526012,526012,"INSTALACION Y MANTENIMIENTO DE PISCINAS,JACUZZIS Y SIMILARES",TRUE
company_activity_551002,551002,HOTEL,TRUE
company_activity_551004,551004,"MOTEL Y/O SERVICIO DE HABITACION OCASIONAL, ALBERGUES, POSADAS Y SIMILARES",TRUE
company_activity_551005,551005,SERVICIO DE SALAS VIP Y PREMIUN EN AEROPUERTOS,TRUE
company_activity_552001,552001,"BARES, CANTINAS O TABERNAS",TRUE
company_activity_552002,552002,CAFETERIAS,TRUE
company_activity_552003,552003,SERVICIOS DE CATERING SERVICE,TRUE
company_activity_552004,552004,"SERVICIO DE RESTAURANTE, CAFETERIAS, SODAS Y OTROS EXPENDIOS DE COMIDA",TRUE
company_activity_552005,552005,SODAS,TRUE
company_activity_552007,552007,OTROS EXPENDIOS DE COMIDAS,TRUE
company_activity_601001,601001,SERVICIO DE TRANSPORTE POR VIA FERREA,TRUE
company_activity_602001,602001,SERVICIO DE TRANSPORTE DE CARGA POR VIA TERRESTRE,TRUE
company_activity_602002,602002,TRANSPORTE DE  PRODUCTOS DERIVADOS DEL PETROLEO,TRUE
company_activity_602101,602101,TRANSPORTE REGULAR DE ESTUDIANTES Y EMPLEADOS POR VIA TERRESTRE,TRUE
company_activity_602102,602102,TRANSPORTE REGULAR DE PASAJEROS POR VIA TERRESTRE,TRUE
company_activity_602201,602201,TRANSPORTE NO REGULAR DE PASAJEROS POR VIA TERRESTRE (EXCURSIONES),TRUE
company_activity_602202,602202,SERVICIO DE TAXI,TRUE
company_activity_602203,602203,SERVICIO ESPECIAL ESTABLE DE TAXI (SEETAXI),TRUE
company_activity_602301,602301,SERVICIO DE ACARREO Y DISTRIBUCION DE TODO TIPO DE MERCANCIA (INCLUYE LA MUDANZA,TRUE
company_activity_602302,602302,SERVICIOS DE GRUA,TRUE
company_activity_602304,602304,SERVICIO DE MUDANZA INTERNACIONAL,TRUE
company_activity_603001,603001,SERVICIO DE TRANSPORTE POR TUBERIAS,TRUE
company_activity_611001,611001,TRANSPORTE DE CARGA POR  VIA ACUATICA,TRUE
company_activity_611002,611002,TRANSPORTE DE CABOTAJE DE PASAJEROS POR  VIA ACUATICA,TRUE
company_activity_621001,621001,SERVICIO DE TRANSPORTE DE CARGA POR VIA AEREA,TRUE
company_activity_621002,621002,SERVICIO DE TRANSPORTE AEREO REGULADO DE PASAJEROS (LINEAS AEREAS),TRUE
company_activity_621003,621003,SERVICIO DE PILOTAJE,TRUE
company_activity_622001,622001,SERVICIO DE TRANSPORTE AEREO NO REGULAR DE PASAJEROS,TRUE
company_activity_630001,630001,PRESTACION DE SERVICIOS DE TRANSITO AEREO,TRUE
company_activity_630101,630101,SERVICIO DE CONSOLIDACION DE CARGA Y DESCARGA,TRUE
company_activity_630201,630201,SERVICIOS DE ALMACENAJE,TRUE
company_activity_630301,630301,PARQUEOS/ESTACIONAMIENTO DE VEHICULOS,TRUE
company_activity_630302,630302,"FUNCIONAMIENTO DE INSTALACIONES TERMINALES COMO PUERTOS, MUELLES Y AEROPUERTOS",TRUE
company_activity_630303,630303,PERMISO DE PASO POR PROPIEDADES PRIVADAS (PEAJE),TRUE
company_activity_630401,630401,ACTIVIDADES DE AGENCIAS DE VIAJES ,TRUE
company_activity_630403,630403,ACTIVIDADES DE OPERADORES TURISTICOS (GUIA  DE TURISMO),TRUE
company_activity_630405,630405,EXPLOTACION DE ACTIVIDADES TURISTICAS(CUYA PRESTACION NO SEA REALIZADA POR UN CE,TRUE
company_activity_630901,630901,ALMACENES FISCALES (DEPOSITOS ADUANEROS) Y ESTACIONAMIENTOSTRANSITORIOS,TRUE
company_activity_630903,630903,AGENCIA DE TRANSPORTE (NAVIERA),TRUE
company_activity_630904,630904,AGENTE ADUANERO INDEPENDIENTE Y AGENCIA DE ADUANAS,TRUE
company_activity_641101,641101,ACTIVIDADES POSTALES Y DE CORREO,TRUE
company_activity_642001,642001,"SERVICIOS DE RADIO-MENSAJES, RADIOLOCALIZADORES Y SIMILARES",TRUE
company_activity_642002,642002,"SERVICIO DE TELEVISION POR CABLE, SATELITE U OTROS SISTEMA S SIMILARES",TRUE
company_activity_642003,642003,MANTENIMIENTO DE REDES DE TELECOMUNICACION,TRUE
company_activity_642004,642004,SERVICIO DE RADIO FRECUENCIA,TRUE
company_activity_642005,642005,"SERVICIOS TELEFONICOS, TELEGRAFICOS Y POR TELEX",TRUE
company_activity_642007,642007,VENTA DE ESPACIO EN EL CABLE SUBMARINO,TRUE
company_activity_642008,642008,"SERVICIO DE TRANSMISION  DE  DATOS, TEXTO, SONIDO, VOZ  Y VIDEO POR MEDIO DE LA",TRUE
company_activity_642009,642009,SERVICIOS DIGITALES O DE TELECOMUNICACIONES E INTANGIBLES PRESTADOS DESDE EL EXTERIOR,TRUE
company_activity_651101,651101,BANCA CENTRAL,TRUE
company_activity_651901,651901,COOPERATIVAS DE AHORRO Y CREDITO,TRUE
company_activity_651903,651903,BANCOS ESTATALES (EXCEPTO EL BANCO CENTRAL),TRUE
company_activity_651904,651904,ENTIDADES FINANCIERAS PRIVADAS (BANCOS),TRUE
company_activity_651905,651905,SERVICIO DE ENVIO Y RECIBO DE DINERO,TRUE
company_activity_651906,651906,INSTITUCIONES DE AHORRO Y CREDITO PARA VIVIENDA,TRUE
company_activity_659101,659101,ARRENDAMIENTO OPERATIVO EN FUNCION FINANCIERA CON OPCION DECOMPRA O RENOVACION (,TRUE
company_activity_659201,659201,ENTIDADES FINANCIERAS DISTINTAS AL SISTEMA BANCARIO NACIONAL,TRUE
company_activity_659202,659202,EMISORAS Y PROCESADORAS DE TARJETAS DE CREDITO,TRUE
company_activity_659901,659901,SERVICIO DE PRESTAMO (PRESTAMISTAS),TRUE
company_activity_659902,659902,FIDEICOMISOS Y/O ADMINISTRADORES DE FONDOS DE INVERSION,TRUE
company_activity_659903,659903,SOCIEDADES DE INVERSION MOBILIARIA,TRUE
company_activity_659904,659904,SERVICIO RECUPERACION DE DEUDAS (FACTORE0),TRUE
company_activity_659905,659905,FONDOS DE INVERSION,TRUE
company_activity_659906,659906,ACTIVIDADES DE SOCIEDADES DE CARTERA (HOLDING),TRUE
company_activity_659907,659907,INGRESOS POR INTERESES DIFERENTES AL COMERCIO DEL PRESTAMO,TRUE
company_activity_659908,659908,FONDOS DE LA LEY DEL SISTEMA DE BANCA PARA EL DESARROLLO,TRUE
company_activity_659909,659909,FIDEICOMISOS DE LA LEY DEL SISTEMA DE BANCA PARA EL DESARROLLO,TRUE
company_activity_660101,660101,SEGUROS DE VIDA,TRUE
company_activity_660201,660201,OPERADORAS DE PENSIONES,TRUE
company_activity_660202,660202,FONDOS DE OPERADORAS DE PENSIONES EXENTOS DEL 8%,TRUE
company_activity_660301,660301,AGENTES DE SEGUROS,TRUE
company_activity_660302,660302,COMERCIALIZADORES DE SEGUROS,TRUE
company_activity_660303,660303,SEGUROS GENERALES,TRUE
company_activity_671101,671101,ADMINISTRACION DE MERCADOS FINANCIEROS,TRUE
company_activity_671201,671201,CORREDORES DE BOLSA,TRUE
company_activity_671202,671202,PUESTOS DE BOLSA,TRUE
company_activity_671901,671901,PUESTOS Y/O CASAS DE CAMBIO DE MONEDA EXTRANJERA,TRUE
company_activity_671902,671902,ASESORES FINANCIEROS Y ACTIVIDADES AUXILIARES DE LA INTERMEDICIACION FINANCIERA,TRUE
company_activity_672001,672001,ACTIVIDADES AUXILIARES DE LA FINANCIACION DE PLANES DE SEGUROS Y DE PENSIONES,TRUE
company_activity_701001,701001,ACTIVIDADES INMOBILIARIAS (ALQUILER DE VIVIENDA SUPERIOR A 1.5 SALARIO BASE),TRUE
company_activity_701002,701002,ALQUILER DE LOCALES COMERCIALES Y CENTROS COMERCIALES,TRUE
company_activity_701003,701003,COMPRA Y VENTA DE PROPIEDADES (INVERSIONISTAS),TRUE
company_activity_701004,701004,ALQUILER DE EDIFICIOS Y PROPIEDADES DIFERENTES A CASAS DE HABITACION,TRUE
company_activity_701005,701005,ALQUILER DE MARCAS REGISTRADAS,TRUE
company_activity_701006,701006,"ALQUILER DE PATENTES (DE LICORES, UNICAMENTE)",TRUE
company_activity_701007,701007,EXPLOTACION DE FRANQUICIAS,TRUE
company_activity_701008,701008,ACTIVIDADES INMOBILIARIAS (ALQUILER DE VIVIENDA INFERIOR A 1.5 SALARIO BASE),TRUE
company_activity_702001,702001,AGENTES O CORREDORES DE BIENES RAICES,TRUE
company_activity_702003,702003,"ADMINISTRACION, MANTENIMIENTO, REPARACION Y LIMPIEZA DE LOS SERVICIOS Y BIENES COMUNES DE LA PROPIEDAD EN CONDOMINIO",TRUE
company_activity_711101,711101,ALQUILER DE AUTOMOVILES  DE TODO TIPO,TRUE
company_activity_711102,711102,ALQUILER DE MOTOCICLETA/SERVICIO,TRUE
company_activity_711103,711103,"ALQUILER DE EQUIPO DE TRANSPORTE POR VIA TERRESTRE, ACUATICA O AEREA",TRUE
company_activity_711105,711105,ALQUILER DE CARRITOS DE GOLF Y OTROS,TRUE
company_activity_712101,712101,ALQUILER DE MAQUINARIA Y EQUIPO PARA USO AGRICOLA,TRUE
company_activity_712201,712201,ALQUILER DE MAQUINARIA Y EQUIPO DE CONSTRUCCION E INGENIERIA CIVIL,TRUE
company_activity_712301,712301,SERVICIOS DE INTERNET EN LOCALES PUBLICOS ( CAFE INTERNET ),TRUE
company_activity_712302,712302,ALQUILER DE MAQUINARIA Y EQUIPO DE OFICINA,TRUE
company_activity_712901,712901,ALQUILER DE MAQUINAS EXPENDEDORAS DE ALIMENTOS Y OTROS,TRUE
company_activity_712902,712902,ALQUILER DE MAQUINAS DE ENTRETENIMIENTO (CON MONEDAS),TRUE
company_activity_712904,712904,ALQUILER DE PELICULAS CINEMATOGRAFICAS (VIDEO CLUB) Y/O VIDEO JUEGOS,TRUE
company_activity_712905,712905,"ALQUILER DE EQUIPO PARA RADIO, TELEVISION Y COMUNICACIONES",TRUE
company_activity_712906,712906,ALQUILER DE EQUIPO PARA DISPENSAR BILLETES (CAJERO AUTOMA-TICO),TRUE
company_activity_712907,712907,ALQUILER MAQUINARIA Y EQUIPO PARA LA ELABORACION Y/O MANTENIMIENTO DE PRODUCTOS,TRUE
company_activity_712909,712909,ALQUILER DE OTROS TIPOS DE MAQUINARIA Y EQUIPO PARA USO COMERCIAL,TRUE
company_activity_712910,712910,ALQUILER DE MAQUINARIA Y/O EQUIPO PARA USO INDUSTRIAL,TRUE
company_activity_712911,712911,ALQUILER DE RAMPAS Y SIMILARES,TRUE
company_activity_713001,713001,ALQUILER DE MENAJE,TRUE
company_activity_713002,713002,ALQUILER DE EQUIPO RECREATIVO Y DEPORTIVO,TRUE
company_activity_713003,713003,ALQUILER DE EQUIPO MEDICO Y ARTICULOS CONEXOS,TRUE
company_activity_713012,713012,ALQUILER DE TRAJES DE TODO TIPO,TRUE
company_activity_713013,713013,ALQUILER DE EQUIPO Y UTENSILIOS PARA EVENTOS ESPECIALES,TRUE
company_activity_713053,713053,"ALQUILER DE ANIMALES (CABALLOS, SERPIENTES, ETC)",TRUE
company_activity_721001,721001,CONSULTORES INFORMATICOS,TRUE
company_activity_722003,722003,"DISENADOR GRAFICO, DE SOFWARE Y PAGINAS WEB",TRUE
company_activity_723001,723001,PROCESAMIENTO DE DATOS,TRUE
company_activity_724001,724001,ACTIVIDADES RELACIONADAS CON BASES DE DATOS,TRUE
company_activity_725001,725001,REPARACION DE EQUIPO DE COMPUTO,TRUE
company_activity_725002,725002,MANTENIMIENTO DE EQUIPO DE COMPUTO,TRUE
company_activity_725003,725003,"REPARACION CAJAS REGISTRADORAS, CALCULADORAS, MAQUINAS DE CONTABILIDAD Y EQUIPO",TRUE
company_activity_725004,725004,"MANTENIMIENTO DE CAJAS REGISTRADORAS, CALCULADORAS, MAQUINAS DE CONTABILIDAD",TRUE
company_activity_729001,729001,OTRAS ACTIVIDADES DE INFORMATICA,TRUE
company_activity_731001,731001,INVESTIGACION Y DESARROLLO EXPERIMENTAL EN EL CAMPO DE LAS CIENCIAS NATURALES ,TRUE
company_activity_731003,731003,METEOROLOGO POR CUENTA PROPIA,TRUE
company_activity_732001,732001,INVESTIGACIONES Y DESARROLLO EXPERIMENTAL EN EL CAMPO DE LAS CIENCIAS SOCIALES ,TRUE
company_activity_741101,741101,"BUFFETE DE ABOGADO, NOTARIO, ASESOR LEGAL",TRUE
company_activity_741203,741203,"ACTVIDAD DE CONTABILIDAD (CONTADORES), TENEDURIA DE LIBROS,AUDITORIA Y ASESOR FINANCIERO",TRUE
company_activity_741301,741301,ASESORES EN MERCADEO Y VENTAS,TRUE
company_activity_074130,074130,2 ENCUESTAS DE OPINION PÚBLICA,TRUE
company_activity_741401,741401,ECONOMISTAS,TRUE
company_activity_741402,741402,ASESORAMIENTO EMPRESARIAL Y EN MATERIA DE GESTION (HANDLING),TRUE
company_activity_741407,741407,ASESOR ADUANERO,TRUE
company_activity_741408,741408,"CORRESPONSAL DE RADIO, TELEVISION Y PRENSA ESCRITA",TRUE
company_activity_742102,742102,ACTIVIDADES DE ARQUITECTURA E INGENIERIA,TRUE
company_activity_742105,742105,SERVICIOS DE CONSULTORIA EN MANTENIMIENTO INDUSTRIAL Y MECANICO,TRUE
company_activity_742107,742107,QUIMICOS,TRUE
company_activity_742108,742108,ACTIVIDADES DE GEOGRAFIA Y/O GEOLOGIA,TRUE
company_activity_742110,742110,BIOLOGO POR CUENTA PROPIA,TRUE
company_activity_074211,074211,2 DIBUJANTE ARQUITECTONICO Y/O PLANOS DE CONSTRUCCION,TRUE
company_activity_742201,742201,ENSAYOS Y ANALISIS TECNICOS,TRUE
company_activity_742202,742202,PROFESIONALES EN TECNOLOGIA DE ALIMENTOS,TRUE
company_activity_743001,743001,PUBLICIDAD,TRUE
company_activity_743004,743004,SERVICIOS DE PUBLICIDAD,TRUE
company_activity_743005,743005,ALQUILER DE ESPACIOS PUBLICITARIOS,TRUE
company_activity_743006,743006,PUBLICIDAD A TRAVES DE MEDIOS ELECTRONICOS,TRUE
company_activity_749101,749101,SERVICIOS DE ADMINISTRACION DE PERSONAL,TRUE
company_activity_749102,749102,SERVICIOS DE BIBLIOTECOLOGIA,TRUE
company_activity_749201,749201,"SERVICIOS DE INVESTIGACION, SEGURIDAD PRIVADA, AGENCIAS Y CONSULTORES",TRUE
company_activity_749204,749204,INSTRUCTOR DE TIRO (MANEJO DE ARMAS).,TRUE
company_activity_749301,749301,SERVICIOS DE FUMIGACION (NO AGRICOLA),TRUE
company_activity_749302,749302,SERVICIOS DE LIMPIEZA (INTERIORES Y EXTERIORES),TRUE
company_activity_749401,749401,ESTUDIOS FOTOGRAFICOS,TRUE
company_activity_749402,749402,SERVICIO DE FOTOGRAFIA (FOTOGRAFO),TRUE
company_activity_749501,749501,SERVICIOS DE ENVASE Y EMPAQUE,TRUE
company_activity_749901,749901,SERVICIO DE FOTOCOPIADO Y OTROS,TRUE
company_activity_749902,749902,SERVICIOS DE LEVANTADO DE TEXTO Y/O CORRECCION DE TEXTOS Y OTROS,TRUE
company_activity_749903,749903,SERVICIOS SECRETARIALES Y/O OFICINISTA,TRUE
company_activity_749904,749904,SERVICIO DE DISENO O DECORACION DE INTERIORES (POR CUENTA PROPIA).,TRUE
company_activity_749905,749905,SERVICIO DE CONTESTACION DE TELEFONOS (CALL CENTER),TRUE
company_activity_749906,749906,SERVICIOS DE TRADUCTOR,TRUE
company_activity_749907,749907,SERVICIO DE INSPECCION DE TODO TIPO DE MERCADERIAS Y ACTIVOS(INCLUYE DROGAS),TRUE
company_activity_749908,749908,SERVICIO DE RECOLECCION DE MONEDAS DE LOS TELEFONOS PUBLICOS,TRUE
company_activity_749911,749911,AGENCIAS FOTOGRAFICAS POR CATALOGO,TRUE
company_activity_749914,749914,SERVCICIO DE COBRANZA DE RECIBOS PUBLICOS Y OTROS,TRUE
company_activity_749917,749917,MODELAJE PROFESIONAL (MODELO),TRUE
company_activity_749918,749918,AGENCIAS DE COBRO Y CALIFICACION CREDITICIA,TRUE
company_activity_751101,751101,ACTIVIDADES DE LA ADMINISTRACION PUBLICA EN GENERAL,TRUE
company_activity_751102,751102,"ACTIVIDADES DE LA ADMINISTRACION PÚBLICA EN GENERAL, NO SUJETAS AL IMPUESTO SOBR",TRUE
