id,code,name,active
company_activity_751103,751103,MUNICIPALIDADES Y CONCEJOS DE DISTRITO,TRUE
company_activity_751106,751106,ACTIVIDADES DE LA ADMINISTRACION PUBLICA EN GENERAL GRAVADAS CON IVA,TRUE
company_activity_751201,751201,"JUNTAS DE EDUCACION, COMEDORES ESCOLARES, PATRONATOS, COOPERATIVAS ESCOLARES, CO",TRUE
company_activity_751202,751202,COMITES CANTONALES DE DEPORTES Y RECREACION,TRUE
company_activity_751301,751301,ACTIVIDADES DEL SECTOR PÚBLICO RELACIONADAS CON LA INFRAESTRUCTURA,TRUE
company_activity_751302,751302,FONDOS PUBLICOS (ACTIVIDADES DEL SECTOR PUBLICO),TRUE
company_activity_751401,751401,ACTIVIDADES DE SERVICIOS AUXILIARES PARA LA ADMINISTRACION PÚBLICA EN GENERAL,TRUE
company_activity_752101,752101,RELACIONES EXTERIORES,TRUE
company_activity_752201,752201,ACTIVIDADES DE DEFENSA,TRUE
company_activity_752301,752301,ACTIVIDADES DE MANTENIMIENTO DEL ORDEN PÚBLICO Y DE SEGURIDAD,TRUE
company_activity_752302,752302,"SERVICIOS DE VIGILANCIA O CONTROL PORTUARIA, COSTERA, AEREA,Y FRONTERIZA",TRUE
company_activity_753001,753001,ACTIVIDADES DE PLANES DE SEGURIDAD SOCIAL DE AFILIACION OBLIGATORIA,TRUE
company_activity_801001,801001,ENSENANZA PREESCOLAR Y PRIMARIA PRIVADA,TRUE
company_activity_801002,801002,ENSENANZA PREESCOLAR Y PRIMARIA PRIVADA NO AUTORIZADOS POR EL MEP,TRUE
company_activity_802101,802101,ENSENANZA SECUNDARIA PRIVADA,TRUE
company_activity_802102,802102,ENSENANZA SECUNDARIA PRIVADA NO AUTORIZADA POR EL MEP,TRUE
company_activity_802201,802201,ENSENANZA DE FORMACION TECNICA Y PARAUNIVERSITARIA,TRUE
company_activity_802202,802202,ENSENANZA SECUNDARIA DE FORMACION TECNICA Y PROFESIONAL NO AUTORIZADA POR EL MEP,TRUE
company_activity_803002,803002,ENSENANZA SUPERIOR PRIVADA (UNIVERSIDADES),TRUE
company_activity_803003,803003,ENSENANZA SUPERIOR PUBLICA (UNIVERSIDADES),TRUE
company_activity_809001,809001,ESCUELAS COMERCIALES (NO ESTATALES),TRUE
company_activity_809004,809004,PROFESOR POR CUENTA PROPIA,TRUE
company_activity_809005,809005,ENSENANZA CULTURAL,TRUE
company_activity_809006,809006,ENSENANZA DE LA DE SEGURIDAD PRIVADA,TRUE
company_activity_809007,809007,ESCUELA Y AGENCIA DE MODELOS,TRUE
company_activity_851101,851101,ACTIVIDADES DE HOSPITALES ,TRUE
company_activity_851201,851201,GINECOLOGO,TRUE
company_activity_851202,851202,SERVICOS DE MEDICO GENERAL,TRUE
company_activity_851203,851203,NEUROLOGOS,TRUE
company_activity_851204,851204,"SERVICIOS DE OFTALMOLOGO U OCULISTA, OPTOMETRISTA Y/O OPTICO",TRUE
company_activity_851206,851206,ORTOPEDISTA (CONSULTA PRIVADA),TRUE
company_activity_851207,851207,SERVICIOS DE ODONTOLOGO Y CONEXOS,TRUE
company_activity_851208,851208,"OTORRINOLARINGOLOGIA, AUDIOLOGIA Y SERVICIOS CONEXOS.",TRUE
company_activity_851209,851209,FARMACEUTICO O BOTICARIO,TRUE
company_activity_851210,851210,CARDIOLOGOS,TRUE
company_activity_851212,851212,ONCOLOGOS,TRUE
company_activity_851213,851213,REUMATOLOGO,TRUE
company_activity_851901,851901,MEDICINA ALTERNATIVA,TRUE
company_activity_851902,851902,FISICO TERAPISTA,TRUE
company_activity_851905,851905,PSICOLOGO,TRUE
company_activity_851906,851906,PSIQUIATRIA,TRUE
company_activity_851907,851907,SERVICIOS DE ENFERMERIA,TRUE
company_activity_851908,851908,LABORATORIOS MEDICOS - CLINICOS,TRUE
company_activity_851909,851909,"SERVICIOS DE RADIOLOGIA, ANESTESIOLOGIA Y OTROS",TRUE
company_activity_851910,851910,TRANSPORTE EN AMBULANCIA TERRESTRE Y AEREO (SERVICIO PRIVADO),TRUE
company_activity_851911,851911,PROFESIONALES EN SALUD OCUPACIONAL,TRUE
company_activity_851912,851912,NUTRICIONISTA,TRUE
company_activity_851913,851913,PROFESIONALES EN EDUCACION ESPECIAL,TRUE
company_activity_851914,851914,SERVICIOS DE PARAMEDICOS,TRUE
company_activity_851915,851915,SERVICIOS DE ESTERILIZACION DE PRODUCTOS MEDICOS Y FARMACEUTICOS,TRUE
company_activity_851916,851916,OTRAS ACTIVIDADES RELACIONADAS CON LA SALUD HUMANA(BANCO DE SANGRE…),TRUE
company_activity_851917,851917,CIRUJANO PLASTICO,TRUE
company_activity_853101,853101,FUNDACIONES DE BIEN SOCIAL,TRUE
company_activity_853102,853102,FUNDACIONES DE SERVICIO SOCIAL (PRIVADAS),TRUE
company_activity_853103,853103,RESIDENCIAS UNIVERSITARIAS CON SERVICIOS INTEGRADOS,TRUE
company_activity_853201,853201,GUARDERIAS/CENTROS INFANTILES Y SERVICIOS SOCIALES,TRUE
company_activity_853202,853202,SERVICIOS SOCIALES DE REDES DE CUIDO  Y CENTROS DE ATENCION DE ADULTOS MAYORES,TRUE
company_activity_853301,853301,ASOCIACIONES DECLARADAS DE UTILIDAD PUBLICA POR EL PODER EJECUTIVO,TRUE
company_activity_900001,900001,"ASESORAMIENTO Y ELIMINACION DE DESPERDICIOS, SANEAMIENTO (EXCEPTO LIMPIEZA DE TANQUES)",TRUE
company_activity_900002,900002,LIMPIEZA DE TANQUES SEPTICOS Y AGUAS REDISUALES,TRUE
company_activity_911101,911101,ACTIVIDADES DE ORGANIZACIONES EMPRESARIALES Y DE EMPLEADORES,TRUE
company_activity_911102,911102,CAMARAS DE COMERCIO,TRUE
company_activity_911201,911201,ACTIVIDADES DE ORGANIZACIONES PROFESIONALES,TRUE
company_activity_912001,912001,ASOCIACIONES SOLIDARISTAS,TRUE
company_activity_912002,912002,ACTIVIDADES DE SINDICATOS,TRUE
company_activity_919101,919101,ACTIVIDADES DE ORGANIZACIONES RELIGIOSAS,TRUE
company_activity_919201,919201,ACTIVIDADES DE ORGANIZACIONES POLITICAS,TRUE
company_activity_919901,919901,ASOCIACION DE DESARROLLO COMUNAL Y/O SERVICIOS COMUNITARIOS,TRUE
company_activity_919903,919903,"ASOCIACIONES O ENTIDADES CON FINES CULTURALES, SOCIALES, RECREATIVOS, ARTESANALE",TRUE
company_activity_919906,919906,ASOCIACIONES ADMINISTRADORAS DE LOS SISTEMAS DE ACUEDUCTOS Y ALCANTARILLADOS (ASADAS),TRUE
company_activity_921101,921101,ACTIVIDADES PRODUCCION POSTPRODUCCION Y DISTRIBUCION DE PELICULAS CINEMATOGRAFIC,TRUE
company_activity_921201,921201,EXHIBICION DE FILMES Y VIDEOCINTAS  (SALAS DE CINE),TRUE
company_activity_921301,921301,TRANSMISIONES DE RADIO,TRUE
company_activity_921302,921302,PROGRAMACION Y TRANSMISIONES DE TELEVISION,TRUE
company_activity_921303,921303,TRANSMISIONES DE RADIO CULTURALES SEGÚN LEY GENERAL DE TELECOMUNICACIONES,TRUE
company_activity_921401,921401,TEATROS (EXPLOTACION),TRUE
company_activity_921402,921402,ACTIVIDADES MUSICALES Y ARTISTICAS (SERVICIOS),TRUE
company_activity_921403,921403,PERIODISTA POR CUENTA PROPIA,TRUE
company_activity_921501,921501,CANALES DE TELEVISION,TRUE
company_activity_921902,921902,"VENTA AL POR MENOR DE DISCOS, GRABACIONES DE MUSICA Y DE VIDEO",TRUE
company_activity_921903,921903,SALON DE BAILE Y DISCOTECA,TRUE
company_activity_921904,921904,SALON DE PATINES,TRUE
company_activity_922001,922001,ACTIVIDADES DE AGENCIAS DE NOTICIAS,TRUE
company_activity_923101,923101,ACTIVIDADES DE BIBLIOTECAS Y ARCHIVOS,TRUE
company_activity_923201,923201,GALERIAS DE ARTE,TRUE
company_activity_923202,923202,SERVICIOS DE RESTAURACION DE OBRAS DE ARTE,TRUE
company_activity_923301,923301,"ACTIVIDADES DE JARDINES BOTANICOS, ZOOLOGICOS, PARQUES NACIONALES Y RESERVAS NACIONALES",TRUE
company_activity_924101,924101,GIMNASIOS,TRUE
company_activity_924102,924102,EXPLOTACION DE PISCINAS O ALBERCAS DE BANO,TRUE
company_activity_924103,924103,"ENTRENADOR, INSTRUCTORES Y/O PREPARADORES FISICOS POR CUENTA PROPIA",TRUE
company_activity_924104,924104,ACTIVIDADES DE ESCUELAS Y CLUBES DEPORTIVOS,TRUE
company_activity_924105,924105,EXPLOTACION DE INSTALACIONES Y CAMPOS DEPORTIVOS,TRUE
company_activity_924106,924106,ACTIVIDADES DEPORTIVAS Y OTRAS POR CUENTA PROPIA,TRUE
company_activity_924107,924107,ESPECTACULOS DEPORTIVOS,TRUE
company_activity_924901,924901,NIGHT CLUB/CABARETTE,TRUE
company_activity_924902,924902,EXPLOTACION DE CASINOS (INCLUYE MESAS DE JUEGOS Y MAQUINAS TRAGAMONEDAS),TRUE
company_activity_924903,924903,PESCA DEPORTIVA,TRUE
company_activity_924904,924904,"ACTIVIDADES DE JUEGOS DE BILLAR, POOL Y OTROS SIMILARES",TRUE
company_activity_924905,924905,SALA DE VIDEO JUEGOS,TRUE
company_activity_924906,924906,"GRABACION DE SONIDO (MUSICA, ETC.) EN DISCOS GRAMOFONICOS YEN CINTA MAGNETOFONIC",TRUE
company_activity_924907,924907,SERVICIO DE ENLACE DE LLAMADAS Y CASAS DE APUESTAS ELECTRONICAS (SPORTBOOKS),TRUE
company_activity_924908,924908,ESPECTACULOS PUBLICOS EN GENERAL EXCEPTO LOS DEPORTIVOS Y EL TEATRO,TRUE
company_activity_924909,924909,OTRAS ACTIVIDADES DE ESPARCIMIENTO,TRUE
company_activity_924910,924910,EXPLOTACION DE JUEGOS DE AZAR NO ELECTRONICOS (INCLUYE MAQUINAS TRAGAMONEDAS,TRUE
company_activity_930101,930101,SERVICIOS DE LAVANDERIA DE TODO TIPO,TRUE
company_activity_930102,930102,SERVICIO DE TENIDO DE PRENDAS DE VESTIR,TRUE
company_activity_930103,930103,SERVICIO DE LIMPIEZA Y LAVADO DE MUEBLES,TRUE
company_activity_930202,930202,"SALONES DE BELLEZA, PELUQUERIA Y BARBERIA",TRUE
company_activity_093030,093030,1 SERVICIOS FUNEBRES Y ACTIVIDADES CONEXAS,TRUE
company_activity_930302,930302,CEMENTERIO PUBLICO (JUNTA ADMINISTRATIVA),TRUE
company_activity_930303,930303,CEMENTERIO O CAMPOSANTO PRIVADO,TRUE
company_activity_930901,930901,SALAS DE MASAJES,TRUE
company_activity_930903,930903,OTRAS ACTIVIDADES DE SERVICIOS PERSONALES N.C.P.,TRUE
company_activity_930904,930904,CENTRO O SALA DE BRONCEADO,TRUE
company_activity_930905,930905,PELUQUERIA Y SALA DE ESTETICA PARA ANIMALES,TRUE
company_activity_930906,930906,SERVICIO DE TATUAJE Y PIERCING,TRUE
company_activity_930907,930907,SERVICIO DE DISCO MOVIL,TRUE
company_activity_930908,930908,SERVICIO DE HERRADURA,TRUE
company_activity_930915,930915,ALBERGUE Y CUIDO DE ANIMALES A DOMICILIO,TRUE
company_activity_950001,950001,HOGARES PRIVADOS CON SERVICIO DOMESTICO,TRUE
company_activity_960104,960104,IMPUESTO A LAS PERSONAS JURIDICAS,
company_activity_960105,960105,ACTIVIDADES PREOPERATIVAS O DE ORGANIZACION,
company_activity_960106,960106,EXPORTADORES DE MERCANCIAS EXENTAS DEL IMPUESTO DE VENTAS,
company_activity_960107,960107,PRODUCTORES DE MERCANCIAS EXENTAS DEL IMPUESTO DE VENTAS,
company_activity_960108,960108,COMERCIALIZADORES DE MERCANCIAS EXENTAS DEL IMPUESTO DE VENTAS,
company_activity_960109,960109,DISTRIBUIDORES DE MERCANCIAS EXENTAS DEL IMPUESTO DE VENTAS,
company_activity_990001,990001,"ACTVIDADES DE ORGANIZACIONES Y ORGANOS EXTRATERRITORIALES, INCLUYE LAS EMBAJADAS",
